{"aggregate_sha256":"e59cd5db8d9fc3331b593860d15531c0eeb1dffba0f7719b89f795a02f7e3ea8","attempt":1,"bindings":{"corpus_manifest_sha256":"04794e31258b596af871a13c1c1b30aab4da1aaa4f315ef1b5b0c6533acd7ee8","f1_freeze_sha256":"6565d94cf3fd8015fd4754bdf0735bf68dae4b5729e92ecb9ab6062b7006d084","program_authority_sha256":"10ec7a6f2a2bf4c303ee98dbf6208caaa1d74dd95e8d5322411a28265f387295","run_manifest_sha256":"cf3cdeecdc4b646082e2093d2811d5473309374de2ed4070b777c9ec28e3e75b"},"candidate_id":"AE-SQ7-SLEC-7","checks":{"eighty_by_four_schedule":false,"exact_custody":false,"formula_totality_and_global_and":false,"forty_unique_cases":false,"independent_two_by_twenty":false,"lifecycle_event_and_counter_closure":false,"one_shot_state_unclaimed":false,"provider_subset_and_local_semantics":false,"recursive_schema_closure":false,"zero_raw_persistence":false,"zero_retry_and_aggregate_only":false},"model_calls":0,"phase":"SQ7-F3","program_id":"AE-SQ7","schema_version":"ae-sq7-preflight-v1","status":"FAIL"}